,Name,About,Category
30,mouse,mouse plural mice small rodent characteristically pointed snout small rounded ears body length scaly tail high breeding rate best known mouse species common house mouse mus musculus also popular pet places certain kinds field mice locally common known invade homes food shelter species mice mostly classified rodentia present throughout order typical mice classified genus mus mice typically distinguished rats size generally someone discovers smaller muroid rodent common name includes term mouse larger name includes term rat common terms rat mouse taxonomically specific scientifically term mouse confined members mus example also applies species genera deer mouse peromyscus domestic mice sold pets often differ substantially size common house mouse attributable breeding different conditions wild best known strain white lab mouse uniform traits appropriate use research cats wild dogs foxes birds prey snakes even certain kinds arthropods known prey heavily upon mice nevertheless remarkable adaptability almost environment mouse one successful mammalian genera living earth today,animal
31,kangaroo,kangaroo marsupial family macropodidae macropods meaning large foot common use term used describe largest species family red kangaroo well antilopine kangaroo eastern grey kangaroo western grey kangaroo kangaroos indigenous australia new guinea australian government estimates million kangaroos lived within commercial harvest areas australia million one year earlier terms wallaroo wallaby kangaroo refers paraphyletic grouping species three refer members taxonomic family macropodidae distinguished according size largest species family called kangaroos smallest generally called wallabies term wallaroos refers species intermediate size also tree kangaroos another type macropod inhabit tropical rainforests new guinea far northeastern queensland islands region general idea relative size informal terms could kangaroos large powerful hind legs large feet adapted leaping long muscular tail balance small head like marsupials female kangaroos pouch called marsupium joeys complete postnatal development large kangaroos adapted much better smaller macropods land clearing pastoral agriculture habitat changes brought australian landscape humans many smaller species rare endangered kangaroos relatively plentiful kangaroo symbol australia appears australian coat arms currency used logo australia well known organisations qantas roundel royal australian air force kangaroo important australian culture national image consequently numerous popular culture references,animal
32,snail,snail loose terms shelled gastropod name often applied land snails terrestrial pulmonate gastropod molluscs however common name snail also used members molluscan class gastropoda coiled shell large enough animal retract completely word snail used general sense includes land snails also numerous species sea snails freshwater snails gastropods naturally lack shell internal shell mostly called slugs land snails small shell cannot retract often called semi slugs snails considerable human relevance including food items pests vectors disease shells used decorative objects incorporated jewelry snail also cultural significance tending associated patience snail also used metaphor someone moving fast enough slow snail snail similar shape cochlea snails respire using lung belong group pulmonata traditionally defined pulmonata found polyphyletic molecular study per j rger et al dating snails gills also form polyphyletic group words snails lungs snails gills form number taxonomic groups necessarily closely related related groups snails lungs snails gills diversified widely geological time species gills found land numerous species lungs found freshwater even marine species lungs snails found wide range environments including ditches deserts abyssal depths sea although land snails may familiar laymen marine snails constitute majority snail species much greater diversity greater biomass numerous kinds snail also found fresh water,animal
33,turtle,cryptodira pleurodira paracryptodira turtles reptiles order testudines characterized special bony cartilaginous shell developed ribs acting shield turtle may refer order whole american english fresh water sea dwelling testudines british english order testudines includes extant living extinct species earliest known members group date middle jurassic making turtles one oldest reptile groups ancient group snakes crocodilians known species alive today highly endangered turtles ectotherms animals commonly called cold blooded meaning internal temperature varies according ambient environment however high metabolic rate leatherback sea turtles body temperature noticeably higher surrounding water turtles classified amniotes along reptiles birds mammals like amniotes turtles breathe air lay eggs underwater although many species live around water group turtles known bale differences exist usage common terms turtle tortoise terrapin depending variety english used terms common names reflect precise biological taxonomic distinctions,animal
34,octopus,traditional see evolution families octopus plural octopuses soft bodied eight limbed mollusc order octopoda k p ok p around species recognised order grouped within class cephalopoda squids cuttlefish nautiloids like cephalopods octopus bilaterally symmetric two eyes beak mouth center point eight limbs soft body rapidly alter shape enabling octopuses squeeze small gaps trail eight appendages behind swim siphon used respiration locomotion expelling jet water octopuses complex nervous system excellent sight among intelligent behaviourally diverse invertebrates octopuses inhabit various regions ocean including coral reefs pelagic waters seabed live intertidal zone others abyssal depths species grow quickly mature early short lived species male uses specially adapted arm deliver bundle sperm directly female mantle cavity becomes senescent dies female deposits fertilised eggs den cares hatch also dies strategies defend predators include expulsion ink use camouflage threat displays ability jet quickly water hide even deceit octopuses venomous blue ringed octopuses known deadly humans,animal
35,lynx,lynx l ks plural lynx lynxes four species canada lynx iberian lynx eurasian lynx bobcat within medium sized wild cat genus lynx name lynx originated middle english via latin greek word derived indo european root leuk light brightness reference luminescence reflective eyes lynx short tail characteristic tufts black hair tips ears large padded paws walking snow long whiskers face neck ruff black bars resembling bow tie although often visible body colour varies medium brown goldish beige white occasionally marked dark brown spots especially limbs species lynx white fur chests bellies insides legs fur extension chest belly fur lynx colouring fur length paw size vary according climate range southwestern united states short haired dark colour paws smaller less padded climates get colder northerly lynx progressively thicker fur lighter colour paws larger padded adapt snow paws may larger human hand foot smallest species bobcat canada lynx largest eurasian lynx considerable variations within species,animal
36,goat,capra hircus linnaeus capra depressa linnaeus capra mambrica linnaeus capra reversa linnaeus domestic goat simply goat capra aegagrus hircus subspecies c aegagrus domesticated wild goat southwest asia eastern europe goat member animal family bovidae subfamily caprinae meaning closely related sheep distinct breeds goat one oldest domesticated species animal used milk meat fur skins across much world milk goats often turned goat cheese female goats referred nannies intact males called bucks billies juvenile goats sexes called kids castrated males called wethers words hircine caprine refer anything goat like quality hircine used often emphasize distinct smell domestic goats million goats living world according un food agriculture organization modern english word goat comes old english g goat goat general turn derives proto germanic gaitaz cf dutch icelandic geit german gei gothic gaits ultimately proto indo european aidos meaning young goat cf latin haedus kid perhaps root meaning jump assuming old church slavonic zaj c hare sanskrit jih te moves related citation needed refer male old english used bucca giving modern buck ousted hegote hegoote late th century nanny goat females originated th century billy goat males th,animal
37,antelope,antelopes comprise wastebasket taxon miscellaneous group within family bovidae encompassing old world ruminants bovines sheep goats antelopes considered sister group deer within infraorder pecora group antelope called herd unlike deer antlers shed grown annually antelope horns grow continuously english word antelope first appeared derived old french antelop derived medieval latin ant h alopus turn comes byzantine greek word anth lops first attested eustathius antioch c according fabulous animal haunting banks euphrates savage hard catch long saw like horns capable cutting trees perhaps derives greek anthos flower ops eye perhaps meaning beautiful eye alluding animals long eyelashes however may later folk etymology word talopus calopus latin came used heraldry first used living cervine animals antelope species native africa occur genera classification tribes subfamilies within bovidae still matter debate several alternative systems proposed antelope cladistic taxonomically defined group term used describe members family bovidae fall category sheep cattle goats usually species alcelaphinae antilopinae hippotraginae reduncinae cephalophinae many bovinae grey rhebok impala called antelopes,animal
38,dodo,dodo raphus cucullatus extinct flightless bird endemic island mauritius east madagascar indian ocean dodo closest genetic relative also extinct rodrigues solitaire two forming subfamily raphinae family pigeons doves closest living relative dodo nicobar pigeon white dodo thought existed nearby island r union thought confusion based r union ibis paintings white dodos subfossil remains show dodo metre ft tall may weighed kg lb wild dodo appearance life evidenced drawings paintings written accounts th century vary considerably illustrations known drawn live specimens exact appearance life remains unresolved little known behaviour though dodo historically considered fat clumsy thought well adapted ecosystem depicted brownish grey plumage yellow feet tuft tail feathers grey naked head black yellow green beak used gizzard stones help digest food thought included fruits main habitat believed woods drier coastal areas mauritius one account states clutch consisted single egg presumed dodo became flightless ready availability abundant food sources relative absence predators mauritius first recorded mention dodo dutch sailors following years bird hunted sailors invasive species habitat destroyed last widely accepted sighting dodo extinction immediately noticed considered mythical creature th century research conducted small quantity remains four specimens brought europe early th century among dried head soft tissue dodo remains today since large amount subfossil material collected mauritius mostly mare aux songes swamp extinction dodo within less century discovery called attention previously unrecognised problem human involvement disappearance entire species dodo achieved widespread recognition role story alice adventures wonderland since become fixture popular culture often symbol extinction obsolescence dodo variously declared small ostrich rail albatross vulture early scientists danish zoologist johannes theodor reinhardt proposed dodos ground pigeons based studies dodo skull discovered collection natural history museum denmark view met ridicule later supported english naturalists hugh edwin strickland alexander gordon melville monograph dodo kindred attempted separate myth reality dissecting preserved head foot specimen oxford university museum comparing remains available extinct rodrigues solitaire pezophaps solitaria concluded two closely related strickland stated although identical birds shared many distinguishing features leg bones otherwise known pigeons strickland melville established dodo anatomically similar pigeons many features pointed short keratinous portion beak long slender naked basal part pigeons also bare skin around eyes almost reaching beak dodos forehead high relation beak nostril located low middle beak surrounded skin combination features shared pigeons legs dodo generally similar terrestrial pigeons birds scales skeletal features depictions large crop hinted relationship pigeons feature developed birds pigeons generally small clutches dodo said laid single egg like pigeons dodo lacked vomer septum nostrils shared details mandible zygomatic bone palate hallux dodo differed pigeons mainly small size wings large size beak proportion rest cranium,animal
39,chicken,chicken gallus gallus domesticus type domesticated fowl subspecies red junglefowl gallus gallus chickens one common widespread domestic animals total population billion billion chickens world bird domesticated fowl humans keep chickens primarily source food consuming meat eggs less commonly pets originally raised cockfighting special ceremonies chickens kept food hellenistic period th nd centuries bc genetic studies pointed multiple maternal origins south asia southeast asia east asia clade found americas europe middle east africa originating indian subcontinent ancient india domesticated chicken spread lydia western asia minor greece th century bc fowl known egypt since mid th century bc bird gives birth every day come egypt land syria shinar babylonia according annals thutmose iii uk ireland adult male chickens age one year primarily known cocks whereas united states canada australia new zealand commonly called roosters males less year old cockerels castrated neutered roosters called capons surgical chemical castration illegal parts world females year old known hens younger females pullets although egg laying industry pullet becomes hen begins lay eggs weeks age australia new zealand also sometimes britain generic term chook k describe ages sexes young often called chicks chicken originally referred young domestic fowl species whole called domestic fowl fowl use chicken survives phrase hen chickens sometimes used british public house theatre name name groups one large many small rocks islands sea see example hen chicken islands,animal
40,hornbill,see text hornbills bucerotidae family bird found tropical subtropical africa asia melanesia characterized long curved bill frequently brightly colored sometimes casque upper mandible common english scientific name family refer shape bill buceros cow horn greek hornbills two lobed kidney birds first second neck vertebrae atlas axis respectively fused together probably provides stable platform carrying bill family omnivorous feeding fruit small animals monogamous breeders nesting natural cavities trees sometimes cliffs number mainly insular species hornbill small ranges threatened extinction namely southeast asia neotropical realm toucans occupy hornbills ecological niche example convergent evolution hornbills show considerable variation size smallest species black dwarf hornbill tockus hartlaubi g oz cm ft length largest massive species appears southern ground hornbill average weight kg lb weigh kg lb span cm ft across wings species rival southern ground species length cm ft including abyssinian ground hornbill bucorvus abyssinicus great hornbill buceros bicornis probably longest perhaps exceeding cm ft thanks part extended tail feathers helmeted hornbill rhinoplax vigil males always bigger females though extent true varies according species extent sexual dimorphism also varies body parts example difference body mass males females variation bill length wing length distinctive feature hornbills heavy bill supported powerful neck muscles well fused vertebrae large bill assists fighting preening constructing nest catching prey feature unique hornbills casque hollow structure runs along upper mandible species barely perceptible appears serve function beyond reinforcing bill species quite large reinforced bone openings hollow centre allowing serve resonator calls helmeted hornbill casque hollow filled hornbill ivory used battering ram dramatic aerial jousts aerial casque butting also reported great hornbill plumage hornbills typically black grey white brown frequently offset bright colours bill patches bare coloured skin face wattles species exhibit sexual dichromatism coloration soft parts varies gender,animal
41,fox,species canini foxes small medium sized omnivorous mammals belonging several genera family canidae foxes flattened skull upright triangular ears pointed slightly upturned snout long bushy tail brush twelve species belong monophyletic true foxes group genus vulpes approximately another current extinct species always sometimes called foxes foxes either part paraphyletic group south american foxes outlying group consists bat eared fox gray fox island fox foxes live every continent except antarctica far common widespread species fox red fox vulpes vulpes recognized subspecies global distribution foxes together widespread reputation cunning contributed prominence popular culture folklore many societies around world hunting foxes packs hounds long established pursuit europe especially british isles exported european settlers various parts new world word fox comes old english derived proto germanic fuhsaz nb turn derives proto indo european pu meaning thick haired tail nb male foxes known dogs tods reynards females vixens young cubs pups kits though latter name confused distinct species called kit foxes vixen one words modern english retains middle english southern dialect v pronunciation instead f e northern english fox versus southern english vox group foxes referred skulk leash earth within canidae results dna analysis shows several phylogenetic divisions,animal
42,pig,pig animals genus sus within even toed ungulate family suidae pigs include domestic pigs ancestor common eurasian wild boar sus scrofa along species pigs like suids native eurasian african continents ranging europe pacific islands suids pig babirusa indonesia pygmy hog asia warthog africa another genus pigs africa suids sister clade peccaries juvenile pigs known piglets pigs highly social intelligent animals around billion individuals alive time domestic pig among populous large mammals world pigs omnivores consume wide range food pigs biologically similar humans thus frequently used human medical research online etymology dictionary provides anecdotal evidence well linguistic saying term derives probably old english picg found compounds ultimate origin unknown originally young pig word adults swine apparently related low german bigge dutch big phonology difficult oed another old english word pig fearh related furh furrow pie perk dig furrow source also latin porc us pig see pork reflects widespread ie tendency name animals typical attributes activities roger lass synonyms grunter oinker sailors fishermen euphemistic avoidance uttering word pig sea superstition perhaps based fate gadarene swine drowned,animal
43,jaguar,jaguar panthera onca large felid species extant member genus panthera native americas jaguar present range extends southwestern united states mexico north america across much central america south paraguay northern argentina south america though single cats living within arizona species largely extirpated united states since early th century listed near threatened iucn red list numbers declining threats include loss fragmentation habitat overall jaguar largest native cat species new world third largest world spotted cat closely resembles leopard usually larger sturdier ranges across variety forested open terrains preferred habitat tropical subtropical moist broadleaf forest swamps wooded regions jaguar enjoys swimming largely solitary opportunistic stalk ambush predator top food chain keystone species plays important role stabilizing ecosystems regulating prey populations international trade jaguars body parts prohibited cat still frequently killed particularly conflicts ranchers farmers south america although reduced range remains large given historical distribution jaguar featured prominently mythology numerous indigenous peoples americas including maya aztec civilizations word jaguar derived iaguara word one indigenous languages brazil wild spotted cat larger wolf onca derived lusitanian name spotted cat brazil larger lynx indigenous peoples guyana call jaguaret,animal
44,squid,squid cephalopods superorder decapodiformes elongated bodies large eyes eight arms two tentacles like cephalopods squid distinct head bilateral symmetry mantle mainly soft bodied like octopuses small internal skeleton form rod like gladius pen made chitin squid diverged cephalopods jurassic occupy similar role teleost fish open water predators similar size behaviour play important role open water food web two long tentacles used grab prey eight arms hold control beak cuts food suitable size chunks swallowing squid rapid swimmers moving jet propulsion largely locate prey sight among intelligent invertebrates groups humboldt squid observed hunting cooperatively preyed sharks fish sea birds seals cetaceans particularly sperm whales squid change colour camouflage signalling species bioluminescent using light counter illumination camouflage many species eject cloud ink distract predators squid used human consumption commercial fisheries japan mediterranean southwestern atlantic eastern pacific elsewhere used cuisines around world often known calamari squid featured literature since classical times especially tales giant squid sea monsters squid members class cephalopoda subclass coleoidea squid orders myopsida oegopsida superorder decapodiformes greek ten legged two orders decapodiform cephalopods also called squid although taxonomically distinct squids differ recognizably gross anatomical features bobtail squid order sepiolida ram horn squid monotypic order spirulida vampire squid vampyroteuthis infernalis however closely related octopuses squid,animal
45,pinniped,pinnipeds pronounced p n p dz commonly known seals widely distributed diverse clade carnivorous fin footed semiaquatic marine mammals comprise extant families odobenidae whose living member walrus otariidae eared seals sea lions fur seals phocidae earless seals true seals extant species pinnipeds extinct species described fossils seals historically thought descended two ancestral lines molecular evidence supports monophyletic lineage descended one ancestral line pinnipeds belong order carnivora closest living relatives bears superfamily musteloids weasels raccoons skunks red pandas diverged million years ago seals range size ft kg lb baikal seal ft kg lb southern elephant seal male also largest member order carnivora several species exhibit sexual dimorphism streamlined bodies four limbs modified flippers though fast water dolphins seals flexible agile otariids use front limbs primarily propel water phocids walruses use hind limbs otariids walruses hind limbs pulled body used legs land comparison terrestrial locomotion phocids cumbersome otariids visible external ears phocids walruses lack pinnipeds well developed senses eyesight hearing adapted air water advanced tactile system whiskers vibrissae species well adapted diving great depths layer fat blubber skin keep warm cold water walrus species covered fur although pinnipeds widespread species prefer colder waters northern southern hemispheres spend lives water come ashore mate give birth molt escape predators sharks killer whales feed largely fish marine invertebrates leopard seal feed large vertebrates penguins seals walruses specialized feeding bottom dwelling mollusks male pinnipeds typically mate one female polygyny although degree polygyny varies species males land breeding species tend mate greater number females ice breeding species male pinniped strategies reproductive success vary defending females defending territories attract females performing ritual displays lek mating pups typically born spring summer months females bear almost responsibility raising mothers species fast nurse young relatively short period time others take foraging trips sea nursing bouts walruses known nurse young sea seals produce number vocalizations notably barks california sea lions gong like calls walruses complex songs weddell seals meat blubber fur coats pinnipeds traditionally used indigenous peoples arctic seals depicted various cultures worldwide commonly kept captivity even sometimes trained perform tricks tasks relentlessly hunted commercial industries products seals walruses protected international law japanese sea lion caribbean monk seal become extinct past century mediterranean monk seal hawaiian monk seal ranked endangered international union conservation nature besides hunting pinnipeds also face threats accidental trapping marine pollution conflicts local people name pinniped derives latin words pinna fin pes pedis foot common name seal originates old english word seolh turn dervied proto germanic selkhaz,animal
