,Name,About,Category
76,france,europe green dark grey european union green france french f listen officially french republic french r publique fran aise pronounced epyblik f z listen country consisting metropolitan france western europe several overseas regions territories xiii metropolitan area france extends mediterranean sea english channel north sea rhine atlantic ocean borders belgium luxembourg germany northeast switzerland monaco italy east andorra spain south overseas territories include french guiana south america several islands atlantic pacific indian oceans country integral regions five situated overseas span combined area square kilometres sq mi total population million may france unitary semi presidential republic capital paris country largest city main cultural commercial centre major urban areas include lyon marseille toulouse bordeaux lille nice france including overseas territories time zones country total iron age metropolitan france inhabited gauls collection celtic tribes area annexed rome bc developing distinct gallo roman culture laid foundation french language germanic franks arrived formed kingdom francia became heartland carolingian empire treaty verdun partitioned empire west francia becoming kingdom france much high middle ages france highly decentralized feudal kingdom authority king barely felt king philip augustus achieved remarkable success strengthening royal power expansion realm doubling size defeating rivals end reign france emerged powerful state europe mid th century french monarchs embroiled series dynastic conflicts english counterparts lasted years emerging victorious said conflicts disputes spain holy roman empire soon followed renaissance ultimately less successful however french culture flourished global colonial empire established th century would become second largest world second half th century dominated religious civil wars catholics protestants huguenots severely weakened country france emerged europe dominant cultural political military power th century louis xiv following thirty years war inadequate financial model inequitable taxation system well endless costly wars maintain predominant position seven years war american war independence among left heavily indebted kingdom precarious situation end th century french revolution saw fall absolute monarchy characterized ancien r gime ashes rose one modern history earliest republics drafted declaration rights man citizen declaration expresses nation ideals day,country
77,germany,coordinates n e europe light green dark grey european union light green germany german deutschland german pronunciation lant officially federal republic germany german bundesrepublik deutschland listen e country central western europe covering area square kilometres sq mi lies baltic north seas north alps south borders denmark north poland czech republic east austria switzerland south france luxembourg belgium netherlands west various germanic tribes inhabited northern parts modern germany since classical antiquity region named germania documented ad beginning th century german territories formed central part holy roman empire th century northern german regions became centre protestant reformation following napoleonic wars dissolution holy roman empire german confederation formed germany became nation state german states unified prussian dominated german empire world war german revolution empire replaced semi presidential weimar republic nazi seizure power led establishment dictatorship world war ii holocaust end world war ii europe period allied occupation two new german states founded federal republic germany generally known west germany german democratic republic east germany federal republic germany founding member european economic community european union german democratic republic communist eastern bloc state member warsaw pact fall communism german reunification saw former east german states join federal republic germany october today germany federal parliamentary republic led chancellor million inhabitants constituent states second populous country europe russia well populous member state european union capital largest city berlin financial centre frankfurt largest urban area ruhr,country
78,spain,coordinates n w europe green dark grey european union green spain spanish espa es pa listen officially kingdom spain spanish reino de espa b country southwestern europe pockets territory across strait gibraltar atlantic ocean continental european territory situated iberian peninsula territory also includes two archipelagos canary islands coast north africa balearic islands mediterranean sea african enclaves ceuta melilla pe n de v lez de la gomera makes spain european country physical border african country morocco h several small islands alboran sea also part spanish territory country mainland bordered south east mediterranean sea except small land boundary gibraltar north northeast france andorra bay biscay west northwest portugal atlantic ocean respectively area km sq mi spain largest country southern europe second largest country western europe european union fourth largest country area european continent population exceeding million spain sixth populous country europe fourth populous country european union spain capital largest city madrid major urban areas include barcelona valencia seville zaragoza laga bilbao,country
79,portugal,europe green dark grey european union green portugal portuguese pu tu al officially portuguese republic portuguese rep blica portuguesa pu lik pu tu ez note country located mostly iberian peninsula southwestern europe westernmost sovereign state mainland europe bordered west south atlantic ocean north east spain territory also includes atlantic archipelagos azores madeira autonomous regions regional governments official national language portuguese portugal oldest nation state iberian peninsula one oldest europe territory continuously settled invaded fought since prehistoric times inhabited pre celtic celtic peoples visited phoenicians carthaginians ancient greeks ruled romans followed invasions suebi visigothic germanic peoples muslim conquest iberian peninsula territory part al andalus portugal country established early christian reconquista founded county portugal gained prominence battle mamede kingdom portugal later proclaimed following battle ourique independence le n recognized treaty zamora th th centuries portugal established first global maritime commercial empire becoming one world major economic political military powers period today referred age discovery portuguese explorers pioneered maritime exploration notably royal patronage prince henry navigator king john ii notable voyages bartolomeu dias sailing beyond cape good hope vasco da gama discovery sea route india european discovery would become brazil time portugal monopolized spice trade divided world hemispheres dominion castile empire expanded military campaigns asia however events lisbon earthquake country occupation napoleonic wars independence brazil erased great extent portugal prior opulence,country
80,kenya,coordinates n e kenya k nj listen officially republic kenya swahili jamhuri ya kenya country eastern africa square kilometres sq mi kenya world th largest country total area population million people kenya th populous country kenya capital largest city nairobi oldest city first capital coastal city mombasa kisumu city third largest city also inland port lake victoria important urban centres include nakuru eldoret kenya third largest economy sub saharan africa nigeria south africa kenya bordered south sudan northwest ethiopia north somalia east uganda west tanzania south indian ocean southeast according archaeological dating associated artifacts skeletal material cushites first settled lowlands kenya bc phase referred lowland savanna pastoral neolithic nilotic speaking pastoralists ancestral kenya nilotic speakers started migrating present day southern sudan kenya around bc european contact began portuguese empire though effective colonisation kenya began th century european exploration interior modern day kenya emerged protectorate established british empire subsequent kenya colony began numerous disputes uk colony led mau mau revolution began subsequent declaration independence independence kenya remained member commonwealth nations current constitution adopted replace independence constitution kenya presidential representative democratic republic elected officials represent people president head state government kenya member united nations commonwealth nations world bank international monetary fund comesa international criminal court international organisations gni kenya lower middle income economy kenya economy largest eastern central africa nairobi serving major regional commercial hub agriculture largest sector tea coffee traditional cash crops fresh flowers fast growing export service industry also major economic driver particularly tourism kenya member east african community trade bloc though international trade organisations categorise part greater horn africa africa kenya largest export market followed european union republic kenya named mount kenya earliest recorded version modern name written german explorer johann ludwig krapf th century travelling kamba caravan led legendary long distance trader chief kivoi krapf spotted mountain peak asked called kivoi told k nyaa k k nyaa probably pattern black rock white snow peaks reminded feathers male ostrich agikuyu inhabit slopes mt kenya call k r k r nyaga kikuyu embu call kirenyaa three names meaning,country
81,sudan,sudan su n arabic n officially republic sudan arabic jumh riyyat n country north east africa bordered egypt north libya northwest chad west central african republic southwest south sudan south ethiopia southeast eritrea east red sea northeast sudan population million estimate occupies square kilometres square miles making africa third largest country also third largest arab world largest country africa arab world area secession south sudan sudan history goes back pharaonic period witnessing kingdom kerma c bc subsequent rule egyptian new kingdom c bc bc rise kingdom kush c bc ad would turn control egypt nearly century fall kush nubians formed three christian kingdoms nobatia makuria alodia latter two lasting around th th centuries much sudan settled arab nomads th th centuries central eastern sudan dominated funj sultanate darfur ruled west ottomans far north entirety sudan conquered muhammad ali dynasty harsh egyptian reign eventually met successful revolt led self proclaimed mahdi muhammad ahmad resulting establishment caliphate omdurman state eventually toppled british would govern sudan together egypt th century saw growth sudanese nationalism britain granted sudan self government independence proclaimed january since independence sudan ruled series unstable parliamentary governments military regimes jaafar nimeiry sudan instituted islamic law exacerbated rift islamic north seat government animists christians south differences language religion political power erupted civil war government forces strongly influenced national islamic front nif southern rebels whose influential faction sudan people liberation army spla eventually concluding independence south sudan sudan experienced year long military dictatorship led omar al bashir accused widespread human rights abuses including torture persecution minorities notably ethnic genocide due role war darfur region broke overall regime actions killed people protests erupted late demanding bashir resignation resulted successful coup tat april country name sudan name given geographical region south sahara stretching western africa eastern central africa name derives arabic bil n land blacks name one several toponyms sharing similar etymologies ultimately meaning land blacks similar meanings reference dark skin inhabitants initially term sudanese negative connotation sudan due association black africans idea sudanese nationalism goes back popularised young intellectuals,country
82,russia,coordinates n e russia c russian federation transcontinental country located eastern europe northern asia covering area square kilometres sq mi largest country world area spanning one eighth earth inhabited land area stretching eleven time zones bordering sovereign nations territory russia extends baltic sea west pacific ocean east arctic ocean north black sea caucasus south million inhabitants living country federal subjects russia populous nation europe ninth populous nation world russia capital largest city moscow major urban areas include saint petersburg novosibirsk yekaterinburg nizhny novgorod kazan chelyabinsk samara east slavs emerged recognisable group europe rd th centuries ad medieval state rus arose th century adopted orthodox christianity byzantine empire beginning synthesis byzantine slavic cultures defined russian culture next millennium rus ultimately disintegrated number smaller states finally reunified grand duchy moscow th century th century nation greatly expanded conquest annexation exploration become russian empire became major european power third largest empire history stretching norway west canada east following russian revolution russian sfsr became largest leading constituent soviet union world first constitutionally socialist state soviet union played decisive role allied victory world war ii emerged recognised superpower rival united states cold war soviet era saw significant technological achievements th century including world first human made satellite launching first humans space following dissolution soviet union russian sfsr reconstituted russian federation recognised continuing legal personality successor ussr following constitutional crisis new constitution adopted russia governed federal semi presidential republic vladimir putin became acting president december russia first president boris yeltsin resigned elected president march since dominated russia political system either president prime minister government accused non governmental organisations human rights abuses authoritarianism corruption russian economy ranks fifth largest europe eleventh largest world nominal gdp fifth largest ppp russia extensive mineral energy resources largest reserves world making one leading producers oil natural gas globally country one five recognised nuclear weapons states possesses largest stockpile nuclear warheads russia major great power well regional power characterised potential superpower russian armed forces ranked world second powerful powerful europe russia hosts world ninth greatest number unesco world heritage sites among world popular tourist destinations permanent member united nations security council active global partner asean well member shanghai cooperation organisation sco g council europe asia pacific economic cooperation apec organization security co operation europe osce international investment bank iib world trade organization wto well leading member commonwealth independent states cis collective security treaty organization csto member eurasian economic union eaeu,country
83,poland,coordinates n e europe green dark grey european union green legend poland polish polska p lska listen officially republic poland polish rzeczpospolita polska c p sp lita p lska listen country located central europe divided administrative subdivisions covering area square kilometres sq mi largely temperate seasonal climate population nearly million people poland fifth populous member state european union poland capital largest metropolis warsaw major cities include krak w wroc aw pozna gda sk szczecin poland bordered baltic sea lithuania russia kaliningrad oblast north belarus ukraine east slovakia czech republic south germany west history human activity polish soil spans thousands years throughout late antiquity period became extensively diverse various cultures tribes settling vast central european plain however western polans dominated region gave poland name establishment polish statehood traced pagan ruler realm coextensive territory present day poland embraced christianity converted catholicism kingdom poland founded cemented longstanding political association lithuania signing union lublin union formed polish lithuanian commonwealth one largest square kilometres square miles populous nations th th century europe uniquely liberal political system adopted europe first written national constitution constitution may,country
84,sweden,coordinates n e europe green dark grey european union green legend sweden swi n swedish sverige sv rj listen officially kingdom sweden swedish konungariket sverige k n ri k sv rj listen nordic country northern europe borders norway west north finland east connected denmark southwest bridge tunnel across resund strait square kilometres sq mi sweden largest country northern europe third largest country european union fifth largest country europe area capital city stockholm sweden total population million million foreign background persons foreign backgrounds defined persons foreign born born sweden foreign born parents low population density inhabitants per square kilometre sq mi persons per km localities swedes live urban areas cover entire land area highest concentration central southern half country sweden part geographical area fennoscandia climate general mild northerly latitude due significant maritime influence spite high latitude sweden often warm continental summers located north atlantic baltic sea vast eurasian russian landmass general climate environment vary significantly south north due vast latitudal difference much sweden reliably cold snowy winters southern sweden predominantly agricultural north heavily forested includes portion scandinavian mountains,country
85,bangladesh,coordinates n e bangladesh b l bengali pronounced ba la de listen officially people republic bangladesh country south asia eighth populous country world population exceeding million people terms landmass bangladesh ranks nd spanning square kilometres sq mi making one densely populated countries world bangladesh shares land borders india west north east myanmar southeast bay bengal south narrowly separated nepal bhutan siliguri corridor china sikkim north respectively dhaka capital largest city nation economic political cultural hub chittagong largest sea port second largest city bangladesh forms larger eastern part bengal region according ancient sacred indian texts r yana mah bh rata vanga kingdom one namesakes bengal region strong naval ally legendary ayodhya ancient classical period indian subcontinent territory home many principalities including pundra gangaridai gauda samatata harikela also mauryan province reign ashoka principalities notable overseas trade contacts roman world export fine muslin silk middle east spreading philosophy art southeast asia pala empire chandra dynasty sena dynasty last pre islamic bengali middle kingdoms islam introduced pala empire trade abb sid caliphate following early conquest bakhtiyar khalji subsequent establishment delhi sultanate preaching shah jal l east bengal faith fully spread across region wealthy bengal sultanate absorbed mughal empire rule briefly interrupted suri empire following death emperor aurangzeb early proto industrialised mughal bengal became semi independent state nawabs bengal region later conquered british east india company battle plassey borders modern bangladesh established separation bengal india august region became east pakistan part newly formed dominion pakistan demarcated boundary partition india later rise pro democracy movement thrived bengali nationalism self determination leading liberation war eventually resulted emergence bangladesh sovereign independent nation bangladesh country world created basis language ethnicity bengalis make total population bangladesh making one ethnically homogeneous states world large muslim population bangladesh makes third largest muslim majority country constitution declares bangladesh secular state establishing islam state religion middle power world politics bangladesh unitary parliamentary democracy constitutional republic following westminster system governance country divided eight administrative divisions sixty four districts although country continues face challenges rohingya refugee crisis corruption adverse effects climate change bangladesh one emerging growth leading economies world also one next eleven countries one fastest real gdp growth rates bangladeshi economy th largest world nominal gdp th largest ppp,country
86,afganistan,afghanistan f n st n f n st n listen pashto dari pashto af nist n av nis n ab dari af nest n av nes n officially islamic republic afghanistan landlocked country crossroads central south asia afghanistan bordered pakistan east south iran west turkmenistan uzbekistan tajikistan north china northeast occupying square kilometers sq mi mountainous country plains north southwest kabul capital largest city population around million composed mostly ethnic pashtuns tajiks hazaras uzbeks settled life emerged afghanistan adjoining areas years ago evolving gradually indus valley civilization third millennium bce indus civilization archaeological sites discovered amu darya shortugai kandahar province mundigak latter flourished bronze age helmand culture indo aryans migrated bactria margiana area gandhara followed rise iron age yaz culture ca bce closely associated culture depicted avesta ancient religious texts zoroastrianism region known ariana fell achaemenid persians th century bce followed alexander great th century bce married roxana bactria kabul valley campaign faced resistance aspasioi assakan tribes greco bactrian kingdom became eastern end hellenistic world following conquest mauryan indians buddhism hinduism flourished region centuries kushan emperor kanishka ruled twin capitals kapi puru apura played important role spread mahayana buddhism china central asia various buddhist hindu dynasties also ruled region including saka kidarite hephthalite alkhon nezak zunbil turk shahi hindu shahi late th century afghanistan became buffer state great game british india russian empire first anglo afghan war british east india company seized control afghanistan briefly following third anglo afghan war country free foreign influence eventually becoming monarchy amanullah khan almost years later zahir shah overthrown republic established second coup afghanistan first became socialist state soviet protectorate evoking soviet afghan war mujahideen rebels country captured islamic fundamentalist taliban ruled totalitarian regime five years removed power us invasion still control significant portion country ongoing war government taliban contributed perpetuation afghanistan problematic human rights record including complications women rights numerous abuses committed sides killing civilians afghanistan unitary presidential islamic republic country high levels terrorism poverty child malnutrition corruption member united nations organisation islamic cooperation south asian association regional cooperation group economic cooperation organization non aligned movement afghanistan economy world th largest gross domestic product gdp billion purchasing power parity country fares much worse terms per capita gdp ppp ranking th countries root name afgh n according scholars derived name vakan assakan ancient inhabitants hindu kush region vakan literally means horsemen horse breeders cavalrymen va aspa sanskrit avestan words horse historically ethnonym afgh n used refer ethnic pashtuns arabic persian form name af n first attested th century geography book hudud al alam last part name stan persian suffix place therefore afghanistan translates land afghans land pashtuns historical sense modern constitution afghanistan however states word afghan shall apply every citizen afghanistan,country
