,Name,About,Category
107,libya,libya l bi listen arabic romanized l biy officially state libya arabic romanized dawlat l biy country maghreb region north africa bordered mediterranean sea north egypt east sudan southeast chad south niger southwest algeria west tunisia northwest sovereign state made three historical regions tripolitania fezzan cyrenaica area almost million square kilometres sq mi libya fourth largest country africa th largest country world libya th largest proven oil reserves country world largest city capital tripoli located western libya contains three million libya seven million people second largest city benghazi located eastern libya latin name libya based name region west nile citation needed used ancient greeks romans north africa citation needed adopted period italian colonization beginning citation needed libya inhabited berbers since late bronze age descendants iberomaurusian capsian cultures phoenicians established trading posts western libya ancient greek colonists established city states eastern libya libya variously ruled carthaginians persians egyptians greeks becoming part roman empire libya early centre christianity fall western roman empire area libya mostly occupied vandals th century invasions brought islam region th century spanish empire knights st john occupied tripoli ottoman rule began libya involved barbary wars th th centuries ottoman rule continued italo turkish war resulted italian occupation libya establishment two colonies italian tripolitania italian cyrenaica later unified italian libya colony second world war libya important area warfare north african campaign italian population went decline libya became independent kingdom military coup overthrew king idris bloodless coup leader muammar gaddafi ruled country libyan cultural revolution overthrown killed libyan civil war two authorities initially claimed govern libya house representatives tobruk general national congress gnc tripoli considered continuation general national congress elected un led peace talks tobruk tripoli governments unified interim un backed government national accord established gnc disbanded support since second civil war broken parts libya split tobruk tripoli based governments well various tribal islamist militias july talks still ongoing gna tobruk based authorities end strife unify divided establishments state including libyan national army central bank libya libya member united nations since non aligned movement arab league oic opec country official religion islam libyan population sunni muslims,country
108,algeria,algeria l ri listen al jeer ee arabic al jaz ir officially people democratic republic algeria country maghreb region north africa capital populous city algiers located far north country mediterranean coast area square kilometres sq mi algeria tenth largest country world largest area african union arab world estimated population million eighth populous country africa algeria bordered northeast tunisia east libya southeast niger southwest mali mauritania western saharan territory west morocco north mediterranean sea country semi arid geography population living fertile north sahara dominating geography south arid geography makes country vulnerable climate change pre algeria known many empires dynasties including ancient numidians phoenicians carthaginians romans vandals byzantines umayyads abbasids idrisid aghlabid rustamid fatimids zirid hammadids almoravids almohads zayyanids spaniards ottomans finally french colonial empire population arab berber practicing islam using official languages arabic berber however french serves administrative education language contexts algerian arabic main spoken language algeria semi presidential republic local constituencies consisting provinces communes counties algeria regional middle power highest human development index non island african countries one largest economies continent based largely energy exports algeria th largest oil reserves world second largest africa ninth largest reserves natural gas sonatrach national oil company largest company africa supplying large amounts natural gas europe algeria one largest militaries africa largest defence budget member african union arab league opec united nations arab maghreb union founding member forms name arabic romanized al jaz ir algerian arabic romanized al dz r french alg rie officially people democratic republic algeria arabic romanized al jumh riyya al jaz iriyya ad muqr iyya biyya french r publique alg rienne mocratique et populaire abbreviated radp,country
109,morocco,coordinates n w morocco r ko listen arabic romanized al rib lit place sun sets west standard moroccan tamazight romanized lme rib officially kingdom morocco arabic romanized al mamlaka al ribiyya lit western kingdom standard moroccan tamazight romanized tageldit n lma rib country located maghreb region north africa overlooks mediterranean sea north atlantic ocean west land borders algeria east western sahara status disputed south morocco also claims exclaves ceuta melilla pe n de v lez de la gomera spanish jurisdiction well several small spanish controlled islands coast capital rabat largest city casablanca morocco spans area km sq mi population million since foundation first moroccan state idris ad country ruled series independent dynasties reaching zenith almoravid almohad rule spanned parts iberia northwestern africa portuguese empire began morocco th century following portuguese conquests along moroccan coast founding settlements lasted th th centuries marinid saadi dynasties resisted foreign domination th century allowing morocco remain northwest african country avoid ottoman occupation alaouite dynasty rules day seized power country strategic location near mouth mediterranean attracted interest europe morocco divided french spanish protectorates international zone tangier regained independence since remained comparatively stable prosperous regional standards fifth largest economy africa morocco claims non self governing territory western sahara formerly spanish sahara southern provinces spain agreed decolonise territory morocco mauritania guerrilla war arose local forces mauritania relinquished claim war lasted ceasefire morocco currently occupies two thirds territory peace processes thus far failed break political deadlock sovereign state unitary semi constitutional monarchy elected parliament country wields significant influence africa arab world considered regional power middle power king morocco holds vast executive legislative powers especially military foreign policy religious affairs executive power exercised government legislative power vested government two chambers parliament assembly representatives assembly councillors king issue decrees called dahirs force law also dissolve parliament consulting prime minister president constitutional court,country
110,norway,coordinates n e europe green dark grey regional language kven indigenous status,country
111,finland,europe green dark grey european union green legend finland finnish suomi suo mi listen swedish finland f nland listen finland swedish finl nd officially republic finland finnish suomen tasavalta swedish republiken finland listen note nordic country located northern europe finland shares land borders sweden west russia east norway north defined gulf bothnia west gulf finland south part baltic sea finland population approximately million making th populous country europe area square kilometres sq mi finland eighth largest country europe sparsely populated country european union helsinki capital finland largest city country finland parliamentary republic consisting regions municipalities archipelago land islands located southwest mainland autonomous region finland climate finland varies due country relatively vast latitudinal differences southern finland classified humid continental climate rest country characterised boreal climate finland considered mainly boreal forest biome majority population lives central southern finland million people living greater helsinki metropolitan area produces third country gdp main language finnish finnic language uralic language family unrelated scandinavian languages swedish second official language finland mainly spoken certain coastal areas country land,country
112,ireland,europe green dark grey ireland rl nd listen irish ire e listen ulster scots airlann rl n island north atlantic separated great britain east north channel irish sea st george channel ireland second largest island british isles third largest europe twentieth largest earth geopolitically ireland divided republic ireland officially named ireland covers five sixths island northern ireland part united kingdom population ireland million ranking second populous island europe great britain million live republic ireland million live northern ireland geography ireland comprises relatively low lying mountains surrounding central plain several navigable rivers extending inland lush vegetation product mild changeable climate free extremes temperature much ireland woodland end middle ages today woodland makes island compared european average non native conifer plantations twenty six extant land mammal species native ireland irish climate influenced atlantic ocean thus moderate winters milder expected northerly area although summers cooler continental europe rainfall cloud cover abundant,country
113,belgium,europe green dark grey european union green belgium officially kingdom belgium country western europe bordered netherlands north germany east luxembourg southeast france southwest north sea northwest covers area km sq mi population million making nd densely populated country world th densely populated country europe density per square kilometre sq mi capital largest city brussels major cities antwerp ghent charleroi li ge bruges namur leuven legally belgium sovereign state federal constitutional monarchy parliamentary system institutional organization complex structured regional linguistic grounds divided three highly autonomous regions flemish region north wallonia south brussels capital region brussels smallest densely populated region well richest region terms gdp per capita belgium home two main linguistic groups communities dutch speaking flemish community constitutes percent population french speaking community comprises percent belgians small german speaking community numbering around one percent exists east cantons brussels capital region officially bilingual french dutch although french dominant language belgium linguistic diversity related political conflicts reflected political history complex system governance made six different governments historically belgium part area known low countries somewhat larger region current benelux group states also included parts northern france western germany modern name derived latin word belgium used julius caesar gallic wars describe region period around bce end middle ages th century area belgium prosperous cosmopolitan center commerce culture clarification needed th early th centuries belgium served battleground many european powers earning moniker battlefield europe reputation strengthened world wars country emerged following belgian revolution seceded netherlands,country
114,luxembourg,europe green dark grey european union green luxembourg l ks mb r listen luk burg luxembourgish l tzebuerg l ts bu listen french luxembourg german luxemburg officially grand duchy luxembourg c landlocked country western europe bordered belgium west north germany east france south capital luxembourg city one four official capitals european union together brussels frankfurt strasbourg seat court justice european union highest judicial authority eu culture people languages highly intertwined neighbours making essentially mixture french german cultures evident nation three official languages french german national language luxembourgish repeated invasions germany especially world war ii resulted country strong mediation france germany among things led foundation european union area square kilometres sq mi one smallest sovereign states europe luxembourg population makes one least populous countries europe far one highest population growth rate foreigners account nearly half luxembourg population representative democracy constitutional monarch headed grand duke henri world remaining sovereign grand duchy luxembourg developed country advanced economy one world highest gdp ppp per capita city luxembourg old quarters fortifications declared unesco world heritage site due exceptional preservation vast fortifications old city history luxembourg considered begin count siegfried acquired rocky promontory roman era fortifications known lucilinburhuc little castle surrounding area imperial abbey st maximin nearby trier siegfried descendants increased territory marriage war vassal relations end th century counts luxembourg reigned considerable territory henry vii became king germans later holy roman emperor house luxembourg produced four emperors high middle ages charles iv elevated county duchy luxembourg duchy eventually became part burgundian circle one seventeen provinces habsburg netherlands centuries city fortress luxembourg great strategic importance situated kingdom france habsburg territories gradually built one reputed fortifications europe belonging france louis xiv austria maria theresa luxembourg became part first french republic empire napoleon,country
115,lithuania,europe green dark grey european union green legend coordinates n e lithuania l ju e ni listen lith ew ay nee lithuanian lietuva l v officially republic lithuania lithuanian lietuvos respublika country baltic region europe lithuania one baltic states situated eastern shore baltic sea southeast sweden denmark lithuania bordered latvia north belarus east south poland south kaliningrad oblast russian exclave southwest lithuania estimated population million people capital largest city vilnius major cities kaunas klaip da lithuanians balts official language lithuanian one two living languages baltic branch indo european language family latvian centuries southeastern shores baltic sea inhabited various baltic tribes lithuanian lands united mindaugas kingdom lithuania created july th century grand duchy lithuania largest country europe present day lithuania belarus ukraine parts poland russia territories grand duchy lublin union lithuania poland formed voluntary two state personal union polish lithuanian commonwealth commonwealth lasted two centuries neighbouring countries systematically dismantled russian empire annexing lithuania territory,country
116,latvia,coordinates n e europe green dark grey european union green legend latvia l tvi l tvi listen latvian latvija latvija livonian le officially known republic latvia latvian latvijas republika livonian le vab country baltic region northern europe since latvia independence referred one baltic states bordered estonia north lithuania south russia east belarus southeast shares maritime border sweden west latvia inhabitants territory km sq mi capital largest city riga notable major cities latvia daugavpils liep ja jelgava j rmala country temperate seasonal climate baltic sea moderates climate although country four distinct seasons snowy winters centuries swedish polish russian rule rule mainly executed baltic german aristocracy republic latvia established november broke away russian empire declared independence aftermath world war however country became increasingly autocratic coup establishing authoritarian regime k rlis ulmanis country de facto independence interrupted outset world war ii beginning latvia forcible incorporation soviet union followed invasion occupation nazi germany occupation soviets courland pocket form latvian ssr next years peaceful singing revolution starting called baltic emancipation soviet rule condemning communist regime illegal takeover ended declaration restoration independence republic latvia may restoring de facto independence august latvia democratic sovereign state parliamentary republic capital city riga served european capital culture latvian official language latvia unitary state divided administrative divisions municipalities nine cities latvians livonians indigenous people latvia latvian lithuanian two surviving baltic languages,country
117,estonia,europe green grey european union green legend estonia estonian eesti e ti listen officially republic estonia estonian eesti vabariik country eastern coast baltic sea northern europe bordered north gulf finland across finland west baltic sea across sweden south latvia km east lake peipus russia km territory estonia consists mainland islands baltic sea covering total area km sq mi water km sq mi land area km sq mi influenced humid continental climate tallinn capital estonia tartu largest cities urban areas country notable cities include narva p rnu kohtla j rve viljandi official language country estonian second spoken finnic language territory estonia inhabited since least bc ancient estonians became last european pagans adopt christianity following livonian crusade th century centuries successive rule germans danes swedes poles russians distinct estonian national identity began emerge th early th centuries culminated independence russia brief war independence end world war initially democratic prior great depression estonia experienced authoritarian rule era silence world war ii estonia repeatedly contested occupied soviet union germany ultimately incorporated former loss de facto independence estonia de jure state continuity preserved diplomatic representatives government exile peaceful singing revolution began soviet rule resulting restoration de facto independence august sovereign state estonia democratic unitary parliamentary republic divided fifteen counties population million estonia one least populous members european union eurozone oecd schengen area nato united nations security council estonia developed country advanced high income economy among fastest growing eu since entry country ranks high human development index compares well measures economic freedom civil liberties education press freedom estonian citizens receive universal health care free education longest paid maternity leave oecd one world digitally advanced societies estonia became first state hold elections internet first state provide e residency,country
118,belarus,coordinates n e europe dark grey legend belarus b l ru belarusian b la rus russian b l rus officially republic belarus belarusian russian formerly known byelorussia belorussia russian landlocked country eastern europe bordered russia northeast ukraine south poland west lithuania latvia northwest capital populous city minsk square kilometres sq mi forested major economic sectors service industries manufacturing th century different states various times controlled lands modern day belarus including kievan rus principality polotsk th th centuries grand duchy lithuania polish lithuanian commonwealth russian empire aftermath russian revolution different states arose competing legitimacy amidst civil war ultimately ending rise byelorussian soviet socialist republic byelorussian ssr became founding constituent republic soviet union belarus lost almost half territory poland polish soviet war much borders belarus took modern shape lands second polish republic reintegrated soviet invasion poland finalized world war ii wwii military operations devastated belarus lost quarter population half economic resources republic redeveloped post war years byelorussian ssr became founding member united nations along soviet union ukrainian ssr parliament republic proclaimed sovereignty belarus july dissolution soviet union belarus declared independence august belarus russia signed treaty greater cooperation forming union state alexander lukashenko served country first president since belarus labeled europe last dictatorship western journalists account country poor human rights record lukashenko self described authoritarian style government lukashenko continued number soviet era policies state ownership large sections economy elections lukashenko rule widely criticized unfair political opposition violently suppressed belarus also country europe officially using death penalty,country
119,moldova,moldova l v listen sometimes uk ld v officially republic moldova romanian republica moldova landlocked country eastern europe bordered romania west ukraine north east south capital city chi u moldovan territory part principality moldavia th century ceded russian empire ottoman empire moldavia vassal state became known bessarabia southern bessarabia returned moldavia three years later united wallachia form romania russian rule restored whole region russian revolution bessarabia briefly became autonomous state within russian republic known moldavian democratic republic february moldavian democratic republic declared independence integrated romania later year following vote assembly decision disputed soviet russia established within ukrainian ssr moldavian autonomous republic massr partially moldovan inhabited territories east bessarabia consequence molotov ribbentrop pact romania compelled cede bessarabia northern bukovina soviet union leading creation moldavian soviet socialist republic moldavian ssr included greater part bessarabia westernmost strip former massr east dniester river august dissolution soviet union underway moldavian ssr declared independence took name moldova constitution moldova adopted strip moldovan territory east bank dniester de facto control breakaway government transnistria since due decrease industrial agricultural output following dissolution soviet union service sector grown dominate moldova economy nation gdp poorest country europe gdp per capita lowest human development index continent moldova parliamentary republic president head state prime minister head government member state united nations council europe world trade organization wto organization security cooperation europe osce guam organization democracy economic development commonwealth independent states cis organization black sea economic cooperation bsec,country
120,uzbekistan,uzbekistan uk z b k st n z st n us z b k st n st n uzbek zbekiston pronounced ozbeki st n officially republic uzbekistan uzbek zbekiston respublikasi country central asia surrounded five landlocked countries kazakhstan north kyrgyzstan northeast tajikistan southeast afghanistan south turkmenistan south west along liechtenstein one two doubly landlocked countries sovereign state uzbekistan secular unitary constitutional republic comprises provinces vilayats one autonomous republic karakalpakstan capital largest city uzbekistan tashkent uzbekistan ancient times part iranian speaking region transoxiana turan first recorded settlers eastern iranian nomads known scythians founded kingdoms khwarazm th th centuries bc bactria th th centuries bce sogdia th th centuries bce fergana rd century bce th century ce margiana rd century bce th century ce area incorporated iranian achaemenid empire period macedonian greek rule ruled iranian parthian empire later sasanian empire muslim conquest persia seventh century muslim conquest th century converted majority population including local ruling classes adherents islam period cities samarkand khiva bukhara began grow rich silk road witnessed emergence leading figures islamic golden age including muhammad al bukhari al tirmidhi ismail samani al biruni avicenna local khwarazmian dynasty central asia whole decimated mongol invasion th century mongol conquests area became increasingly dominated turkic peoples city shahrisabz birthplace turco mongol conqueror timur tamerlane th century established timurid empire proclaimed supreme emir turan capital samarkand became world centre science rule ulugh beg giving birth timurid renaissance territories timurid dynasty conquered uzbek shaybanids th century moving centre power samarkand bukhara region split three states khanate khiva khanate kokand emirate bukhara conquests emperor babur towards east led foundation india proto industrialised mughal empire gradually incorporated russian empire th century tashkent becoming political center russian turkestan national delimitation constituent republic soviet union known uzbek soviet socialist republic created following dissolution soviet union declared independence republic uzbekistan august uzbekistan diverse cultural heritage due storied history strategic location constitutional official language uzbek turkic language written modified latin alphabet spoken natively approximately population russian widespread use inter ethnic communication language language governance uzbeks constitute population followed russians tajiks kazakhs others muslims constitute population population follow russian orthodox christianity population follow religions non religious majority uzbeks non denominational muslims uzbekistan member cis osce un sco officially democratic republic non governmental human rights organisations defined uzbekistan authoritarian state limited civil rights following death islam karimov second president shavkat mirziyoyev started new course described quiet revolution revolution stated intended abolish cotton slavery systematic use child labour exit visas introduce tax reform create four new free economic zones amnestied political prisoners relations neighbouring countries kyrgyzstan tajikistan afghanistan drastically improved however amnesty international report human rights country described continued repressive measures including forced labour cotton harvesting restrictions movement freed prisoners,country
